,GAMES AVAILABLE,MOVIES MOST LOVED BY PEOPLE,TV SHOWS
0,Caves of Qud,Dekalog (1988),Planet Earth: Blue Planet II
1,Stellar Blade,The Conformist,The Office (UK)
2,Sonic x Shadow Generations,The Godfather,America to Me
3,Silent Hill 2,The Leopard (re-release),The U.S. and the Holocaust
4,Astro Bot,Rear Window,O.J.: Made in America
5,Master Detective Archives: RAIN CODE+,Lawrence of Arabia (re-release),Bo Burnham: Inside
6,Songs Of Silence,Citizen Kane,Planet Earth II
7,VAIL VR,Tokyo Story,The Staircase
8,"Warhammer 40,000: Space Marine II",Casablanca,The Larry Sanders Show
9,Tactical Breach Wizards,Boyhood,Homicide: Life on the Street
10,Sheepy: A Short Adventure,Three Colors: Red,The Sopranos
11,Turbo Kid,Notorious,City So Real
12,BeamNG.drive,Vertigo,Bleak House
13,CONSCRIPT,Fanny and Alexander (re-release),Homecoming: A Film by Beyoncé
14,Nevergrind Online,Singin' in the Rain,Samurai Jack
15,Granblue Fantasy: Relink,Playtime,Fleabag
16,Crime Scene Cleaner,Touch of Evil,The Underground Railroad
17,3 Minutes To Midnight,Army of Shadows,Atlanta
18,Workers & Resources: Soviet Republic,City Lights,Romeo & Juliet
19,Satisfactory,Moonlight,My So-Called Life
20,The Universim,Intolerance,Genndy Tartakovsky's Primal
21,Pine Hearts,The Rules of the Game,The Last Movie Stars
22,Cryptmaster,Pinocchio,This Is Going To Hurt
23,The Land Beneath Us,Seven Samurai,It's a Sin
24,Paper Lily - Chapter 1,The Wild Bunch,Borgen
25,BlazBlue Entropy Effect,Au hasard Balthazar,Frozen Planet
26,Felvidek,The Lady Vanishes,The Wire
27,Apollo Justice: Ace Attorney Trilogy,Pépé le Moko (re-release),The Zen Diaries of Garry Shandling
28,Megaton Musashi W: Wired,The Treasure of the Sierra Madre,Last Chance U: Basketball
29,Closer the Distance,Pan's Labyrinth,The Night Of
30,Anomaly Agent,Some Like It Hot,The Last Dance
31,Classified: France '44,North by Northwest,The Corner
32,Prince of Persia: The Lost Crown,Hoop Dreams,How to With John Wilson
33,Like a Dragon: Infinite Wealth,Rashomon,The Vietnam War
34,Balatro,The Passion of Joan of Arc,A Black Lady Sketch Show
35,Neva,All About Eve,Boomtown
36,Crypt Custodian,Metropolis (re-release),Battlestar Galactica (2003)
37,Until Then,Jules and Jim,Reservation Dogs
38,Another Code: Recollection,My Left Foot,Visible: Out on Television
39,Vertigo 2,The Night of the Hunter,The Shield
40,Diplomacy is Not an Option,Ran,Olive Kitteridge
41,Unicorn Overlord,Gone with the Wind,Murder One
42,MADiSON VR,The Third Man,My Brilliant Friend
43,SAND LAND,Dr. Strangelove or: How I Learned to Stop Worrying and Love the Bomb,A Parks and Recreation Special
44,Persona 3 Reload,"Quo Vadis, Aida?",Somebody Somewhere
45,Sins of a Solar Empire II,Rififi (re-release),The Americans
46,Elden Ring: Shadow of the Erdtree,Psycho,The Returned
47,The Bridge Curse 2: The Extrication,"4 Months, 3 Weeks and 2 Days",Fraggle Rock: Back to the Rock
48,Shogun Showdown,Parasite,The Hollow Crown
49,Anito Legends,Battleship Potemkin,The Responder
50,Ace Combat 7: Skies Unknown Deluxe Edition,A Streetcar Named Desire,Everybody Hates Chris
51,Cubethon,The Maltese Falcon,Mind Over Murder
52,[REDACTED],American Graffiti,Sherlock
53,The Mortuary Assistant,12 Angry Men,The Roosevelts: An Intimate History
54,Angry stone,Dumbo,Rectify
55,Tsukihime: A Piece of Blue Glass Moon,Roma,Better Things
56,Visions of Mana,Man with a Movie Camera,Brooklyn Bridge
57,Animal Well,Spirited Away,Longford
58,Minishoot' Adventures,Toy Story,Barry
59,Bloomtown: A Different Story,"Summer of Soul (...Or, When the Revolution Could Not Be Televised)",Freaks and Geeks
60,Five Nights at Freddy's: Help Wanted 2,The Shop Around the Corner,Muhammad Ali
61,The Pirate Queen: A Forgotten Legend,12 Years a Slave,Baby Reindeer
62,Library Of Ruina,Manchester by the Sea,Back to Life
63,Eternal end,The Battle of Algiers,Malcolm in the Middle
64,Paper Trail,A Hard Day's Night,The Curse
65,Teenage Mutant Ninja Turtles: Splintered Fate,Killer of Sheep,Master of None
66,Fear the Spotlight,Nashville,Springsteen on Broadway
67,Uncover the Smoking Gun,Red River,Catastrophe
68,Son and Bone,Rosemary's Baby,Happy Valley
69,Marvel vs. Capcom Fighting Collection: Arcade Classics,The Philadelphia Story,Lenox Hill
70,Black Zork,Sansho the Bailiff,Felicity
71,Remnant II: The Forgotten Kingdom,Ratatouille,Mr. Show with Bob and David
72,Beltmatic,The Grapes of Wrath,Louie
73,Dragon Ball: Sparking! Zero,Snow White and the Seven Dwarfs,The Baby-Sitters Club (2020)
74,Metaphor: ReFantazio,Children of Paradise (1945),Rain Dogs
75,Super Mario Party Jamboree,Mean Streets,John Mulaney & The Sack Lunch Bunch
76,The Legend of Zelda: Echoes of Wisdom,The Lady Eve,Sherwood
77,DOOM + DOOM II,Gravity,The Simpsons
78,Ace Attorney Investigations Collection,Fantasia,Ed
79,Final Fantasy VII Rebirth,Beauty and the Beast,Mrs. America
80,Shadows of the Damned: Hella Remastered,Small Axe: Lovers Rock,City of Men
81,MySims: Cozy Bundle,The Bride of Frankenstein,Breaking Bad
82,F1 Manager 2024,Don't Look Now,Modern Family
83,Shin Megami Tensei V: Vengeance,The Social Network,Pachinko
84,KILL KNIGHT,My Fair Lady,Boston Med
85,Spin Rhythm XD,Portrait of a Lady on Fire,PEN15
86,Cat Quest III,I Am Not Your Negro,Band of Brothers
87,MULLET MADJACK,Woodstock,The Bear
88,Broken Sword - Shadow of the Templars: Reforged,Do Not Expect Too Much From the End of the World,Painting With John
89,Paper Mario: The Thousand-Year Door,Aftersun,Game of Thrones
90,The Rise of the Golden Idol,Rocks,Hacks
91,Infinite Chef,Amour,Howards End
92,Bad Parenting 1: Mr. Red Face,The Hurt Locker,Beef
93,Antstream Arcade,Anatomy of a Murder,The Pacific
94,Resident Evil 4: Gold Edition,Pulp Fiction,Justified
95,Romancing SaGa 2: Revenge of the Seven,Zero Dark Thirty,Deadwood: The Movie
96,DOOM + DOOM II,Collective,Harley Quinn
97,Ace Attorney Investigations Collection,A Separation,When They See Us
98,Shadows of the Damned: Hella Remastered,Double Indemnity,American Crime
99,Tiebreak: The Official Game of the ATP and WTA,Sunrise,The Trip to Bountiful
100,Five Hearts Under One Roof,La Dolce Vita,Prohibition
101,ANTONBLAST,Schindler's List,Wolf Hall
102,FANTASIAN Neo Dimension,WALL-E,Elizabeth Is Missing
103,Batman: Arkham Shadow,Carol,I May Destroy You
104,Dragon Ball: Sparking! Zero,Before Midnight,Top Boy
105,Metaphor: ReFantazio,Amazing Grace,Mad Men
106,Super Mario Party Jamboree,Dunkirk,Better Call Saul
107,The Legend of Zelda: Echoes of Wisdom,The Man Who Shot Liberty Valance,The Rehearsal
108,Drova - Forsaken Kin,The Searchers,Line of Duty
109,Indiana Jones and the Great Circle,45 Years,Chloe
110,Enigma of Fear,Taxi Driver,Succession
111,Emio - The Smiling Man: Famicom Detective Club,Inside the Yellow Cocoon Shell,Arcane
112,Legacy of Kain: Soul Reaver 1 & 2 Remastered,The Servant,Undone
113,1000xRESIST,Yi Yi,Transparent
114,Nine Sols,The Manchurian Candidate,"The Black Church: This Is Our Story, This Is Our Song"
115,Farewell North,Mr. Turner,Last Call: When A Serial Killer Stalked Queer New York
116,The WereCleaner,The Irishman,I Hate Suzie
117,Empire of the Ants,Grave of the Fireflies (1988),Prehistoric Planet
118,Black Myth: Wukong,"Crouching Tiger, Hidden Dragon",Dreaming Whilst Black
119,Snufkin: Melody of Moominvalley,The Wild Child,Hemingway
120,Empire of the Ants,Stop Making Sense,Hemingway
121,INDIKA,Shadow of a Doubt,The Beatles: Get Back
122,Outcast: A New Beginning,Inside Out,Deadwood
123,Momodora: Moonlit Farewell,Meet Me in St. Louis,Show Me a Hero
124,The Operator,Sideways,Pushing Daisies
125,WARNO,Sunset Boulevard,Colin From Accounts
126,Dread Delusion,The Apartment,Lady Dynamite
127,Kingdom Come: Deliverance - Royal Edition,Apocalypse Now,Six by Sondheim
128,Sker Ritual,The Gunfighter,Between the World and Me
129,ZERO Sievert,We Were Here,Buffy the Vampire Slayer
130,Core Keeper,Faces Places,"McCartney 3,2,1"
131,Gestalt: Steam & Cinder,Days of Heaven,Little America
132,Senua's Saga: Hellblade II,Past Lives,Back
133,Sons of the Forest,Chimes at Midnight,Treme
134,Braid Anniversary Edition,The Lord of the Rings: The Return of the King,I'm A Virgo
135,"Little Kitty, Big City",Badlands,Unorthodox
136,Eiyuden Chronicle: Hundred Heroes,All We Imagine as Light,Shogun (2024)
137,VLADiK BRUTAL,Call Me by Your Name,The Deuce
138,UFO 50,Trenque Lauquen Parte I,Rick & Morty
139,Alaloth - Champions of The Four Kingdoms,Trenque Lauquen Parte II,The Normal Heart
140,Hauntii,Carlos,House of Cards
141,The Plucky Squire,Marriage Story,Rescue Me
142,Solium Infernum,The French Connection,George Carlin's American Dream
143,Slave Zero X,Elevator to the Gallows,Watchmen (2019)
144,Frostpunk 2,La La Land,Wonderland
145,Disney Epic Mickey: Rebrushed,"Jeanne Dielman, 23, quai du commerce, 1080 Bruxelles",Feel Good (2020)
146,Anger Foot,Petite Maman,What's My Name: Muhammad Ali
147,Gestalt: Steam & Cinder,Lady Bird,Wu-Tang Clan: Of Mics and Men
148,Senua's Saga: Hellblade II,The Magnificent Ambersons,A Very English Scandal
149,Sons of the Forest,Rio Bravo,Silicon Valley
150,Braid Anniversary Edition,Reversal of Fortune,Insecure
151,Sker Ritual,David Byrne’s American Utopia,Los Espookys
152,WARNO,Masculine Feminine,The Crime of the Century
153,Kingdom Come: Deliverance - Royal Edition,Shoplifters,The Good Lord Bird
154,Dread Delusion,Shoah: Four Sisters,RAMY
155,Berserk Boy,The 39 Steps,Elvis Presley: The Searcher
156,Core Keeper,Duck Soup,Full Frontal with Samantha Bee
157,Fading Afternoon,Toni Erdmann,Russian Doll
158,Bo: Path of the Teal Lotus,The Discreet Charm of the Bourgeoisie,Broadchurch
159,KinitoPET,Uncut Gems,Big Boys
160,Halls of Torment,McCabe & Mrs. Miller,The Last of Us
161,The Plucky Squire,Inside Llewyn Davis,EZ Streets
162,Banishers: Ghosts of New Eden,The Best Years of Our Lives,Immigration Nation
163,Turnip Boy Robs a Bank,Band of Outsiders,The Dresser (2016)
164,Tiny Glade,Stagecoach,MasterChef Junior
165,Tavern Talk,Our Body,Curb Your Enthusiasm
166,Alaloth - Champions of The Four Kingdoms,The Life and Death of Colonel Blimp (1945),Leaving Neverland
167,New Star GP,Days of Being Wild (re-release),Poker Face (2023)
168,Thank Goodness You're Here!,Sherpa,Seinfeld
169,Interaction Isn't Explicit.,There Will Be Blood,Nashville (2012)
170,Horizon Forbidden West: Complete Edition,Tristana (re-release),Dear White People (2017)
171,Halls of Torment,The Last Picture Show,Our Planet
172,The Legend of Heroes: Trails through Daybreak,Hard to Be a God,Fargo
173,Alone in the Dark,Do the Right Thing,The Trade
174,Fate/stay night REMASTERED,Sita Sings the Blues,Irma Vep
175,The Last of Us Part II Remastered,The Decline of Western Civilization,All Creatures Great and Small (2021)
176,Alan Wake II: Night Springs Expansion,Yojimbo,No Direction Home: Bob Dylan
177,Beyond Galaxyland,TÁR,Too Close
178,Elden Ring: Shadow of the Erdtree Edition,Werckmeister Harmonies,Monty Python: Almost the Truth (The Lawyer's Cut)
179,Crow Country,Top Hat,Sports Night
180,Duck Detective: The Secret Salami,Brother's Keeper,Rivals
181,Brothers: A Tale of Two Sons Remake,Sankofa,Lost
182,Alisa: Developer's Cut,Crumb,Wise Guy: David Chase and The Sopranos
183,Shadow of the Ninja - Reborn,No Bears,Fantasmas
184,Rivals of Aether II,8½,The American Buffalo
185,Riven,Spotlight,We Are Lady Parts
186,Splatoon 3: Expansion Pass Wave 2 - Side Order,Solaris (1972),Extras
187,Age of Mythology: Retold,The Band Wagon,Twin Peaks
188,Berserk Boy,Late Spring (1949),Exterminate All the Brutes
189,Bo: Path of the Teal Lotus,Ikiru,P-Valley
190,Fading Afternoon,One More Time with Feeling,Big Mouth
191,Mario vs. Donkey Kong,The Wizard of Oz,The Kids in the Hall
192,World of Goo 2,Ride the High Country,Our Boys
193,Lacey's Wardrobe,Memoria,Whoopi Goldberg Presents Moms Mabley
194,Horizon Chase 2,The Diving Bell and the Butterfly,Stolen Youth: Inside the Cult at Sarah Lawrence
195,Final Fantasy XVI: The Rising Tide,Invasion of the Body Snatchers,1971: The Year That Music Changed Everything
196,Content Warning,Close-Up,Evil
197,Super Monkey Ball Banana Rumble,The Class,English Teacher
198,Persona 3 Reload - Episode Aigis: The Answer,Platoon,A Small Light
199,The Smurfs: Dreams,No Country for Old Men,We Need to Talk About Cosby
200,Gundam Breaker 4,Chinatown,We Own This City
201,Nikoderiko: The Magical World,Here,Roots (2016)
202,A Quiet Place: The Road Ahead,35 Shots of Rum,Severance
203,Arzette: The Jewel of Faramore,Apocalypse Now: Final Cut,Time of Death
204,Withering Rooms,King Kong,Random Acts Of Flyness
205,Poppy Playtime Chapter 1,Umberto D (re-release),Abbott Elementary
206,S.T.A.L.K.E.R.: Legends of the Zone Trilogy,Secrets & Lies,What We Do in the Shadows (2019)
207,Castaway,The Florida Project,Interview With the Vampire
208,Arranger: A Role-Puzzling Adventure,Timbuktu,Cosmos: A Space-Time Odyssey
209,Dragon Quest III HD-2D Remake,Frenzy,Jerrod Carmichael Reality Show
210,Frostpunk 2,Days,Masters of Sex
211,Disney Epic Mickey: Rebrushed,Brief Encounter,Jackie Robinson
212,Anger Foot,Cool Hand Luke,Northern Exposure
213,Tekken 8,Little Women,NYPD Blue
214,Europa,The Act of Killing,Behind the Candelabra
215,KinitoPET,De Humani Corporis Fabrica,Unbelievable
216,Nobody Wants to Die,Maborosi,Boardwalk Empire
217,SteamWorld Heist II,Beauty and the Beast (re-release),Brockmire
218,Fears to Fathom - Woodbury Getaway,E.T. The Extra-Terrestrial,Surviving R. Kelly
219,Akimbot,Apocalypse Now Redux,Sorry for Your Loss
220,Slitterhead,Never Rarely Sometimes Always,Friday Night Lights
221,Helldivers 2,Annie Hall,L.A. Law
222,Luigi's Mansion 2 HD,The Lord of the Rings: The Fellowship of the Ring,X-Men '97
223,Romance of the Three Kingdoms 8 Remake,Quiz Show,Tuca & Bertie
224,HYPERCHARGE: Unboxed,Leviathan,The Midnight Gospel
225,Lollipop Chainsaw RePOP,Menus Plaisirs - Les Troisgros,Slow Horses
226,New World: Aeternum,Le Cercle Rouge (1970),And Then There Were None (2016)
227,Just Dance 2025 Edition,Toy Story 3,Veep
228,Warhammer 40K: Rogue Trader - Void Shadows,The Souvenir,Normal People
229,Red Dead Redemption Featuring Undead Nightmare,This Is Spinal Tap,Survivor's Remorse
230,Hunt: Showdown 1896,Goodfellas,Why Didn't They Ask Evans?
231,Spectre Divide,The Zone of Interest,Blue Lights
232,Atlas Fallen: Reign Of Sand,Alphaville,Wartorn: 1861-2010
233,Another Crab's Treasure,The Look of Silence,The Dust Bowl
234,Rogue Waters,Tower,I Think You Should Leave with Tim Robinson
235,Castlevania Dominus Collection,Burning,Marathon: The Patriot's Day Bombing
236,Mouthwashing,Drive My Car,BoJack Horseman
237,Marvel Rivals,Moolaadé,The Tick
238,MiSide,A Summer's Tale,Wormwood
239,Shiren the Wanderer: The Mystery Dungeon of Serpentcoil Island,Saint Omer,A Young Doctor's Notebook
240,Ravenswatch,Atanarjuat: The Fast Runner,The Honorable Woman
241,Frostpunk 2,L.A. Confidential,The Wonder Years
242,Disney Epic Mickey: Rebrushed,Three Colors: White,At Home with Amy Sedaris
243,Anger Foot,Time,Cunk on Earth
244,Marvel Rivals,Gavagai,The Dark Crystal: Age of Resistance
245,S.T.A.L.K.E.R. 2: Heart of Chornobyl,A Bread Factory Part Two: Walk With Me a While,The Plot Against America
246,Ys X: Nordics,The Killing,GLOW
247,Loco Motive,Swing Time,Kingdom of Silence
248,The Thing: Remastered,Breaking Away,High School
249,Skydance's BEHEMOTH,Lost in Translation,Chernobyl
250,Mario & Luigi: Brothership,Ryuichi Sakamoto | Opus,Mayflies
251,Vampire Survivors: Ode to Castlevania,Soundtrack to a Coup d'Etat,Legion
252,Five Nights at Freddy's: Into the Pit,After Life,Louis C.K.: 2017
253,Venture to the Vile,Son of Saul,Broad City
254,Infinity Nikki,Love Affair,The White Lotus
255,Botany Manor,Frankenstein,As We See It
256,Squirrel with a Gun,Little Women,Waffles and Mochi
257,Once Human,I Am Cuba,Please Like Me
258,Silent Hill: The Short Message,The African Queen,One Day at a Time (2017)
259,Star Wars: Hunters,The Triplets of Belleville,Maid
260,Open Roads,Monty Python and the Holy Grail,Scott Pilgrim Takes Off
261,V Rising,The Man Who Would Be King,The Good Place
262,Spirit Hunter: Death Mark II,Flee,The Night Manager
263,Metal Slug Tactics,All Quiet on the Western Front,Beartown
264,Inkulinati,EX LIBRIS: The New York Public Library,Bargain
265,Last Epoch,Repulsion (re-release),The Other Two
266,Harold Halibut,Tótem,The Handmaid's Tale
267,Ereban: Shadow Legacy,Young Mr. Lincoln,Law & Order: UK
268,Ara: History Untold,The Ladykillers,Ghosts
269,Welcome to ParadiZe,The Texas Chain Saw Massacre,The Missing
270,Killer Klowns from Outer Space: The Game,Stories We Tell,Jesus Christ Superstar Live in Concert
271,Once Human,The Boy and the Heron,Alias Grace
272,Silent Hill: The Short Message,A Bread Factory Part One: For the Sake of Gold,Little Dorrit
273,Star Trucker,On the Waterfront,High Maintenance (2016)
274,Go Mecha Ball,Jafar Panahi's Taxi,Burton and Taylor
275,MechWarrior 5: Clans,Ida,The Nine
276,Princess Peach: Showtime!,All the Beauty and the Bloodshed,National Treasure (2017)
277,Indigo Park: Chapter 1,Beau Travail,Mike Judge's Beavis and Butt-Head
278,Pixel Gun 3D: PC Edition,Her,Star Wars: Visions
279,Pacific Drive,Waltz with Bashir,This Way Up
280,Galacticare,Hit the Road,Top Of The Lake
281,Wuthering Waves,"This Is Not a Burial, It's a Resurrection",Mo
282,The Inquisitor,They Shall Not Grow Old,Toy Story That Time Forgot
283,Dragon's Dogma 2,An Autumn Afternoon,The Good Wife
284,Hollowbody,The Favourite,Heartstopper
285,Alan Wake II: The Lake House Expansion,The Sweet Hereafter,A Raisin in the Sun
286,Supermarket Simulator: Prologue,The Right Stuff,Jane the Virgin
287,DeathSprint 66,Bambi,Cheer (2020)
288,Zet Zillions,Bringing Up Baby,Elizabeth I
289,Until Dawn,Nostalgia for the Light,Time
290,Metro Awakening VR,The Gatekeepers,Dark Winds
291,Spirit Hunter: Death Mark II,Before Sunset,Men of a Certain Age
292,Demon Slayer: Kimetsu no Yaiba - Sweep the Board!,Anora,Central Park
293,Zenless Zone Zero,La Chimera,Homeland
294,Pepper Grinder,The Worst Person in the World,Casual
295,The First Descendant,David Copperfield,Telemarketers
296,Bandle Tale: A League of Legends Story,Saving Private Ryan,The Legend of Vox Machina
297,Wild Bastards,Licorice Pizza,The Wrong Mans
298,WWE 2K24,Ben-Hur,Cheers
299,Children of the Sun,Only Yesterday (1991),Years of Living Dangerously
300,Poppy Playtime: Chapter 3,32 Sounds,Mare of Easttown
301,Master Key,The Crying Game,Lemony Snicket's A Series of Unfortunate Events (2017)
302,Monster Hunter Stories,Great Expectations,Never Have I Ever
303,Bleak Faith: Forsaken,First Cow,Bill Russell: Legend
304,Copycat,Mad Max: Fury Road,Station Eleven
305,Horizon Zero Dawn Remastered,Le Samouraï,Five Came Back
306,Squirrel with a Gun,Halloween,The Affair
307,CYGNI: All Guns Blazing,Ghost World,David Makes Man
308,Creatures of Ava,Winter's Bone,All The President's Men Revisited
309,LEGO Horizon Adventures,The Queen,Call The Midwife
310,Volgarr the Viking II,Gett: The Trial of Viviane Amsalem,Absolutely Fabulous (UK)
311,Foamstars,I Called Him Morgan,Mindhunter
312,Once Human,All of Us Strangers,Black Bird
313,Foamstars,Close Encounters of the Third Kind,Say Nothing
314,Star Trucker,The Godfather: Part II,Girls5eva
315,Go Mecha Ball,The Hustler,Country Music
316,Master Key,Red Beard,Adam Sandler: Love You
317,Creatures of Ava,Procession,Patrick Melrose
318,LEGO Horizon Adventures,"The Good, the Bad and the Ugly",Keep Sweet: Pray and Obey
319,WWE 2K24,My Voyage to Italy,The Sympathizer
320,Monster Hunter Stories,Bloody Sunday,Girls
321,Bleak Faith: Forsaken,The Brutalist,Generation Kill
322,Mika and The Witch's Mountain,Blue Is the Warmest Color,Being Human (UK)
323,HAWKED,American Splendor,Orange is the New Black
324,Sword Art Online: Fractured Daydream,Phantom Thread,Mr. Robot
325,LYSSA: Goddess of LOVE,Monsieur Hulot's Holiday,In Restless Dreams: The Music of Paul Simon
326,Call of Duty: Black Ops 6,Gosford Park,Atlanta's Missing and Murdered: The Lost Children
327,Contra: Operation Galuga,No Other Land,I'll Be Gone in the Dark
328,Star Wars: Dark Forces Remaster,The Birds,Star Trek: Strange New Worlds
329,The Thaumaturge,Wojnarowicz,The Long Road Home
330,Fairy Tail 2,It's Such a Beautiful Day,Crazy Ex-Girlfriend
331,Broken Roads,Paths of the Soul,From the Earth to the Moon
332,MultiVersus,My Perestroika,Five Days
333,REYNATIS,The Souvenir: Part II,Rap Sh!t
334,Spy Guy Hidden Objects Deluxe Edition,This Is Not a Film,"I Love You, Now Die: The Commonwealth v. Michelle Carter"
335,Morbid: The Lords of Ire,To Have and Have Not,Dirty Money (2018)
336,eFootball 2025,Finding Nemo,"The Thief, His Wife and the Canoe"
337,Planet Coaster 2,Topsy-Turvy,Circus
338,Sorry We're Closed,Samurai Rebellion,The Ghost Army
339,Robin Hood - Sherwood Builders,Sugarcane,Mr Bates vs the Post Office
340,War Hospital,Small Axe: Mangrove,My Adventures with Superman
341,Magical Delicacy,The Incredibles,Guilt (2021)
342,Under Night In-Birth II Sys:Celes,Being John Malkovich,The Sixth Commandment
343,Earth Defense Force 6,Green Border,Players (2022)
344,Star Wars Outlaws,A Prophet,Documentary Now!
345,EA Sports College Football 25,Almost Famous,Narcos: Mexico
346,The Casting of Frank Stone,High and Low,Pretty Little Liars: Original Sin
347,MotoGP 24,Oppenheimer,"Dr. Katz, Professional Therapist"
348,World of Warcraft: The War Within,Paths of Glory,Downton Abbey
349,Endless Ocean Luminous,Scarface,The Guardians of the Galaxy Holiday Special
350,Dead Rising Deluxe Remaster,Cold War,The Newspaperman: The Life and Times of Ben Bradlee
351,Harry Potter: Quidditch Champions,The Truman Show,Difficult People
352,Phantom Fury,Once,The Hour (UK)
353,Moon Mystery,Big Men,The Challenger Disaster
354,SaGa Emerald Beyond,The Circus,Dream On
355,Final Fantasy XIV: Dawntrail,Hannah and Her Sisters,The Staircase (2022)
356,Fabledom,The Tale,Endeavour
357,Expeditions: A MudRunner Game,Paterson,Toy Story of Terror
358,Beyond Hanwell,The Blue Angel,Unbreakable Kimmy Schmidt
359,Millennia,The Fits,The Good Fight
360,Throne and Liberty,Raging Bull,Les Miserables (2019)
361,#BLUD,Eyes Without a Face [re-release],Lupin
362,Felix the Cat,United 93,24
363,NBA 2K25,The Lavender Hill Mob,Speechless (2016)
364,Teenage Mutant Ninja Turtles Arcade: Wrath of the Mutants,Capturing the Friedmans,Get Millie Black
365,Teenage Mutant Ninja Turtles: Mutants Unleashed,American Hustle,Agatha Christie’s The Witness for the Prosecution
366,Funko Fusion,The Passenger (re-release),South Side
367,KAKU: Ancient Seal,Star Wars: Episode IV - A New Hope,Amend: The Fight for America
368,Enotria: The Last Song,Persepolis,Archer
369,Atomic Heart: Trapped in Limbo,The Age of Innocence,The Queen's Gambit
370,UFL,The Deer Hunter,Unforgotten
371,Microsoft Flight Simulator 2024,Eternal Sunshine of the Spotless Mind,Swagger
372,Asphalt Legends Unite,The Best of Youth,The Lying Life of Adults
373,Supermarket Owner Simulator: Business,The Overnighters,The Tourist
374,Life is Strange: Double Exposure,Fat City,Nolly
375,XDefiant,The Lives of Others,Justified: City Primeval
376,Starship Troopers: Extermination,Two-Lane Blacktop,Frasier
377,Kong: Survivor Instinct,House of Flying Daggers,Enlightened
378,Death Note: Killer Within,63 Up,Dharma & Greg
379,Mortal Kombat 1: Khaos Reigns,Minding the Gap,One Hundred Years of Solitude
380,Flintlock: The Siege of Dawn,Treasure Island,ER
381,Solo Leveling:Arise,Investigation of a Citizen Above Suspicion [re-release],The Fall
382,Diablo IV: Vessel of Hatred,Searching for Bobby Fischer,Sense and Sensibility
383,Zoochosis,Whiplash,Sesame Street
384,Jujutsu Kaisen: Cursed Clash,"Two Days, One Night",Mr. Dynamite: The Rise of James Brown
385,TopSpin 2K25,Killers of the Flower Moon,State of the Union
386,Starfield: Shattered Space,National Gallery,Now and Again
387,Mortal Kombat 1: Khaos Reigns,Assault on Precinct 13,Agents of Chaos
388,Flintlock: The Siege of Dawn,Man on Wire,Lovecraft Country
389,Kong: Survivor Instinct,Nickel Boys,Fleishman Is in Trouble
390,Death Note: Killer Within,Y Tu Mamá También,Gavin and Stacey
391,Farming Simulator 25,For Sama,Ren Faire
392,Undisputed,Force of Evil,Landscapers
393,Little Big Adventure: Twinsen's Quest,White Heat,Lights Out
394,Utopia City,The Hidden Fortress,Diarra From Detroit
395,Men of War II,Elle,Witness
396,Homeworld 3,Still Walking,Everyone Else Burns
397,Test Drive Unlimited Solar Crown,Gangs of Wasseypur,The Walking Dead
398,Suicide Squad: Kill The Justice League,Thelma & Louise,Bodyguard
399,Skull and Bones,After Hours,Magpie Murders
400,Madden NFL 25,When the Levees Broke: A Requiem in Four Acts,Everything's Gonna Be Okay
401,MLB The Show 24,Borat: Cultural Learnings of America for Make Benefit Glorious Nation of Kazakhstan,Black Lightning
402,Garten of Banban,Minari,This American Life
403,NHL 25,Barry Lyndon,Stephen King's It
404,Goat Simulator: Remastered,The Farewell,Spotless
405,Dragon Age: The Veilguard,The Tale of The Princess Kaguya,Dead Ringers (2023)
406,Capes,Captain Blood,Parenthood (1990)
407,Star Wars: Battlefront Classic Collection,Uncertain,Manhattan
408,EA Sports FC 25,Great Freedom,Life on Mars (UK)
409,Little Strays,A Star Is Born,Party of Five
410,Unknown 9: Awakening,No End in Sight,In The Flesh
411,Concord,It's a Wonderful Life,Project Greenlight
412,The Crush House,The Madness of King George,The Haunting of Hill House
413,Olympics Go! Paris 2024,Phoenix,Last Chance U
414,Dustborn,Goodbye Solo,Anne with an E
415,,Gunda,Deutschland 83
416,,Western,Wild Wild Country
417,,The Power of the Dog,Joan of Arcadia
418,,Mr. Bachmann and His Class,Vietnam in HD
419,,Sullivan's Travels,Penelope
420,,Deep Red,Simone Biles Rising
421,,Downhill Racer,The Game (2014)
